username,date,text,replies,reposts,likes,bookmarks,views
Taloooly_,2025-02-16T10:40:07.000Z,"WHERE IS THE ONE UI 7 UPDATE FFS?!?!?!

WHY ARE YOU LYING TO YOUR CUSTOMERS, SAMSUNG???",0,0,10,0,306
heibanbaize,2025-02-18T14:52:53.000Z,我看到大家都在用母语骂，那我就不翻译了，三星的妈妈就是死掉了，这些韩国棒子一个个都掉到钱眼里面去了，就是明确的知道S25相比S24没有任何升级，所以要生硬的制造卖点，OneUI7给独占个几个月，建议卢泰文的母亲在下葬的时候坟墓也独占几个月，真司马东西，不想想这样能丢失多少老用户。,0,0,9,0,380
bigmx1985u1,2025-02-14T10:10:40.000Z,Gave  everyone  the over priced chip with an old selfie  camera old main lens and old 3x zoom,0,0,8,0,483
Krjnkow,2025-02-16T14:27:28.000Z,"I bought my S24+, Watch 4 and Tab S9 last year. I was a loyal Fan of Samsung, but this greedy behavior to hold back the One UI 7 Update to push S25 sales is unacceptable. You promised 7 Years of update support for the customer. This is just scam... SHAME ON YOU!",0,0,8,0,568
GasparePia44277,2025-02-14T21:11:21.000Z,"Really? No I'm not going to buy s25, you do all this to sell as much as you can. I'm sorry but I'm going to other brand definitely if updates don't arrive by the end of March!",0,0,7,0,425
_SincerelyJMS,2025-02-15T04:30:12.000Z,"I just joined the Android family under the Samsung Umbrella, and for this to be my first big update, I was very excited and eager to see what was to come.
This delay in the UI 7 release has put a bad taste towards Samsung and is not a very good first impression.",0,0,7,0,346
313_mahdy_313,2025-02-15T07:27:48.000Z,Shame on u samsung from the best phone company to the worst in the world wide shame on u we were waiting for the ui7 it was supposed to be in 7 Feb then h said 15 and now for not April even may shame on. From best to worst,0,0,7,0,116
LandiManaj,2025-02-14T14:36:56.000Z,Wors company ever i will switch to google i have s24 ultra and all my friends with chinese phones already have android 15 and mee with the most expensive phone im stuck at android 14 f u samsung,0,0,5,0,131
AhmedBilwal,2025-02-14T16:41:36.000Z,So after taking away bluetooth functionality from S Pan what downgrade you are planning for next year?? Removing S Pen completely??,0,0,5,0,236
imdanny4real,2025-02-17T18:55:54.000Z,Where is OneUI 7 for my s24 Ultra !!!!!!!!!,0,0,5,0,164
jeevansagar90,2025-02-14T22:53:23.000Z,7 years of software update in just papers.. in reality samsung sucks way behind all other brands ... Going back to IOS ...,0,0,4,0,273
neofakelight,2025-02-15T13:48:37.000Z,"Forcing us to buy s25 series, delayed oneui 7 to s23 and s24 series, you should be embarrassed",0,0,4,0,179
SferikTrader,2025-02-15T16:20:16.000Z,"Part ll:
Hamilton,la course a permis de prendre mon train à temps.
La sécurisation de l'IA risque de coûter + cher que les informations qu'elle rapporte.
France
Dépourvue
Prime
Note:L'histoire se répète toujours 2 fois.
ps:De réseau à réseau ""Data Access"".",0,0,2,0,340
itachi161879,2025-02-15T21:13:13.000Z,I got a green and pink line on galaxy s23+ and what am i supposed to do?!! Upgrade to galaxy s25???? Is that why i got the lines when i updated my phone????,0,0,4,0,313
imdanny4real,2025-02-17T18:58:06.000Z,Why buy the s25 Ultra with fake 7 years of updates when it will only get the stock UI it launched on for 2 years,0,0,4,0,101
mrka80,2025-02-17T19:10:24.000Z,I switched from Apple to Samsung. Now i sell this shit and buy a pixel. Do you really think that someone will buy a s25 for the update.....cmon.....,0,0,4,0,72
ur_no_one,2025-02-17T19:31:02.000Z,"Dear @SamsungMobile you have lost a fan , cause samsung have been failed to release android 15 / one ui 7 for S24 ultra . As a samsung fan i don't have any interest in buying s25 cuz of this shit will heppen next year and force to buy S26 if you want a update ,Crazy and sad turth",0,0,4,0,386
JBG9397,2025-02-14T09:24:56.000Z,Is the news of the S24 one ui7 official update in April true?,0,0,3,0,377
Sora_Kun_94,2025-02-14T10:28:52.000Z,"Better stay quiet.
Release an official statement about the shift in SW updates that do not undermine the Intelligence of your customers, bug fixes as in color calibrations in a mode that 1% of users use and was spotted 1 month later after the latest beta is not an excuse.
Provide",0,0,3,0,258
Xynsquidward,2025-02-14T12:17:55.000Z,if you're still doing shit like this then i will switch to apple,0,0,3,0,163
DiaQuoise,2025-02-14T15:58:12.000Z,Awesome,0,0,3,0,240
eQYMCAE0R641243,2025-02-15T08:19:06.000Z,When will S24 series oneui7.0 be delivered? Is this how Samsung treats its old users?,0,0,3,0,269
mts1304,2025-02-16T03:15:00.000Z,"It's a shame you don't release ONE UI7 for S24. The one and only reason you don't do it, is the desire to sell S25. Read these comments, you are damaging your reputation.",0,0,3,0,217
heibanbaize,2025-02-16T05:49:43.000Z,"Samsung, you’re taking forever with the One UI 7.0 beta! Do you really think S24 users will automatically upgrade to the S25? Obsessing over your half-baked AI while having the slowest R&D pace I’ve ever seen—what’s there to hype? Just paying influencers to gaslight everyone?",0,0,3,0,281
ITIG007,2025-02-19T10:29:31.000Z,How to get it free,0,0,3,0,26
AnnaKilarska,2025-02-14T09:51:22.000Z,"Wow!! Samsung, you're ",0,0,2,0,530
kolpat23,2025-02-14T13:56:51.000Z,"I'm so tempted to go somewhere else, the way you want to treat customers is crazy. No one UI 7 despite paying hundreds and hundreds of dollars for these devices. #gross",0,0,2,0,203
jeevansagar90,2025-02-14T22:49:55.000Z,One ui 7 for s24 ultra again delayed till april seroulsu ... it's worst could ever happen to just one year old ... apple is best... moving from here bye .. shittiest brand ever,0,0,2,0,253
aimeebel,2025-02-14T23:33:14.000Z,Zoomed 3.8x just now ,0,0,2,0,139
Nikonwuya,2025-02-15T15:05:13.000Z,s24user＝,0,0,2,0,82
r83410,2025-02-15T21:26:28.000Z,"For some reason I can't change my phone now, otherwise I would have changed my phone to another brand a long time ago, every minute I spend with my Samsung phone makes me feel like I'm just an idiot who got his money stolen",0,0,2,0,268
eQYMCAE0R641243,2025-02-15T08:19:06.000Z,When will S24 series oneui7.0 be delivered? Is this how Samsung treats its old users?,0,0,3,0,269
mts1304,2025-02-16T03:15:00.000Z,"It's a shame you don't release ONE UI7 for S24. The one and only reason you don't do it, is the desire to sell S25. Read these comments, you are damaging your reputation.",0,0,3,0,217
heibanbaize,2025-02-16T05:49:43.000Z,"Samsung, you’re taking forever with the One UI 7.0 beta! Do you really think S24 users will automatically upgrade to the S25? Obsessing over your half-baked AI while having the slowest R&D pace I’ve ever seen—what’s there to hype? Just paying influencers to gaslight everyone?",0,0,3,0,281
ITIG007,2025-02-19T10:29:31.000Z,How to get it free,0,0,3,0,26
AnnaKilarska,2025-02-14T09:51:22.000Z,"Wow!! Samsung, you're ",0,0,2,0,530
kolpat23,2025-02-14T13:56:51.000Z,"I'm so tempted to go somewhere else, the way you want to treat customers is crazy. No one UI 7 despite paying hundreds and hundreds of dollars for these devices. #gross",0,0,2,0,203
jeevansagar90,2025-02-14T22:49:55.000Z,One ui 7 for s24 ultra again delayed till april seroulsu ... it's worst could ever happen to just one year old ... apple is best... moving from here bye .. shittiest brand ever,0,0,2,0,253
aimeebel,2025-02-14T23:33:14.000Z,Zoomed 3.8x just now ,0,0,2,0,139
Nikonwuya,2025-02-15T15:05:13.000Z,s24user＝,0,0,2,0,82
r83410,2025-02-15T21:26:28.000Z,"For some reason I can't change my phone now, otherwise I would have changed my phone to another brand a long time ago, every minute I spend with my Samsung phone makes me feel like I'm just an idiot who got his money stolen",0,0,2,0,268
trucrusader,2025-02-16T07:33:47.000Z,S25 needs the fastest charging ie. 45w currently and all the specs of the s25+. That will make it more competitive with the iPhone 16pro. Software  and security updates must be faster and consistent,0,0,2,0,199
StefanoSci76747,2025-02-16T11:23:36.000Z,i feel like i bought a 1200€ s24 ultra and i dont even have a os update. i see people with a 2022/2023 other brand flagship that have android 15 and i still have android 14,0,0,2,0,142
StanislavG11787,2025-02-17T07:11:54.000Z,I think this year we will see the collapse of Samsung's dominance among Android devices #oneui7,0,0,2,0,173
yuzaunivi,2025-02-18T03:27:20.000Z,Nk,0,0,2,0,2
panda_cees,2025-02-18T04:56:08.000Z,I'm pretty sure once they announce the fold 7 and don't bring actual updates I'll most likely be switching out of Samsung. At least there are actual competitors now with foldables. Playing the waiting game.,0,0,2,0,94
KhalifaTijani99,2025-02-19T16:30:46.000Z,"———————︵   
—————— /    /
—————--/—-/
—————-/—-/
———--/′ˉ/'--'/′ˉ`•_
———-/'/--/—-/—--/¨ˉ\
——--('(———- ˉ~/'--')
———\————-'—--/
———-'\'————_-•′
————\———--(
———
 Release the update quickly, you lazy people. I have been waiting for 2 months and I have not received it yet on my24U",0,0,2,0,59
bharath1002,2025-02-14T11:10:32.000Z,I have been using @SamsungIndia  ultra for last 10 days. Explored all features and it is no where a premium phone to buy at that cost and never beats @Apple in near future.  Poor @Samsu,0,0,0,0,61
Mostafa_md1,2025-02-14T12:14:39.000Z,"It is a shame you can not make a stable ui and release it
You are clowns, we have to go for iphone or pixel",0,0,0,0,159
ChrisJmnzC,2025-02-14T16:51:23.000Z,"The pixels with the beta of Android 16 and you can not even let go Android 15, I will no longer use Samsung in the future.",0,0,0,0,282
tyshpt,2025-02-14T17:43:09.000Z,So the other ones don't have it?,0,0,0,0,220
_arnav_022,2025-02-14T17:52:42.000Z,"Samsung made us fool 
I phones are way better to give updates",0,0,0,0,127
Baptizium,2025-02-14T09:28:23.000Z,You know its not working like in the ad,0,0,0,0,290
r83410,2025-02-14T11:28:55.000Z,#scamsung,0,0,0,0,316
lterlemez,2025-02-14T19:21:15.000Z,"I do not even care since my Gear Sport Watch and Note 8 is abandoned and Note 8 which will never ever get an update again, still has a support for Watch 7 in order to be sold.",0,0,0,0,274
dirt_xd,2025-02-14T23:39:59.000Z,"Where's my android 15 update samsung, stop jerking off to AI and deliver the update already",0,0,0,0,93
KhalifaTijani99,2025-02-15T14:50:00.000Z,Stupid company I will not change my 24ultra It is despicable that you force us to buy s25  this will be my last samsung you have disappointed us and it seems that you do not even consider us a part of your community this is disrespectful and this is completely unacceptable,0,0,0,0,84
top1only1,2025-02-16T08:51:14.000Z,"Ya absolutely fucking genius samsung. Retards and here is a  for thr officials.  When the actual fuckk is thr ui7 popping for s23 and s24????? No one's buying ur micro penis s25 you korean assssss,  get Yr update quick",0,0,0,0,152
lesyo_,2025-02-16T12:30:29.000Z,This is probably my last ever Samsung. Will be selling my fold 6 and s24 ultra. The Galaxy watch and then the Galaxy buds 3 pro,0,0,0,0,184
odirah_cellz,2025-02-16T20:21:25.000Z,"Hey @Samsungmobile
I genuinely wan̈na know why we don't get to receive accessories in new devices?

How could you guys package and sell a phone without a charger?",0,0,0,0,66
RedPaperDuck,2025-02-16T21:10:16.000Z,How about we talk about the UI7 update instead? Been using exclusively Samsung products since the Mega 2 came out and the delays have left a bad twist in my mouth. Really thinking about switching over to pixel after my s24u has run its course.,0,0,0,0,132
ZaidiSafeer,2025-02-17T07:57:43.000Z,"Scamsung, where's the one ui 7 updates 
You pathetic scum",0,0,0,0,11
