username,date,text,replies,reposts,likes,bookmarks,views
SamsungMobile,2025-03-06T04:00:16.000Z,"World Sleep Day: Recovering from daylight savings may take more than three weeks, youngest hit hardest. #GalaxyAI",35,20,174,8,37636
Taloooly_,2025-03-06T18:07:37.000Z,"You're a fucking pathetic company with made up lies with 7 YEARS OF OS UPGRADES

It's almost a year since One UI 7 beta was released yet every android phone has Android 15, yet last year's flagship phone S24 ULTRA didn't recive shit.",0,0,5,0,283
Samrak2k3,2025-03-08T10:04:28.000Z,#scamsung,0,0,3,0,78
DarrenNaija,2025-03-07T06:22:57.000Z,Dnt sell ur overpriced phone in india mf companies,0,0,2,0,86
AFLakatos,2025-03-09T21:40:49.000Z,Just release One UI 7 for S24's already. Nobody else is gonna buy your piece of shit S25's.,0,0,2,0,337
Somtouwakwe,2025-03-07T17:05:45.000Z,"Dear Samsung, It's the 3rd week now and I didn't get any response from you guys on the replacement of my phone. No phone no Money. I just wanted to let you guys know that as a first timer using a Samsung product, this has been the worst experience I've had in my life",0,0,0,0,26
shahoazimii,2025-03-07T18:04:57.000Z,How can you lie about 7 years of update support when you can't update your phones after 1 year??,0,0,0,0,79
uurinanc,2025-03-09T11:51:47.000Z,"I bought the s24 that came with Android 14. I used the s24 for 1 year before the new version came out. 1 year later, the s25 came out with Android 15. Android 15 will still waiting to the s24 series! Damn it, I won't use Samsung anymore.",0,0,0,0,87
dalvina98980959,2025-03-10T02:50:33.000Z,Por favor SAMSUNG ADICIONA a ONE UI 7.0 Para o S20FE  pois até o A04e com 3GB de Memória RAM Receberá eo S20 + S20FE Não ,0,0,0,0,167
mfarooqbukhsh,2025-03-06T04:02:13.000Z,"Galaxy is amazing 
Let's enjoy the beautiful sunlight and save energy and time as well 
#Samsung",0,0,0,0,278
r83410,2025-03-06T10:04:35.000Z,Do you want updates without any (intentional) delays and a beautiful and smooth system interface? Buy an iPhone or Pixel~ #scamsung,0,0,0,0,43
